{
  "$schema": "https://json-schema.org/draft/2020-12/schema",
  "type": "object",
  "properties": {
    "summary": {
      "$ref": "#/$defs/__schema0"
    },
    "proposedSteps": {
      "$ref": "#/$defs/__schema1"
    },
    "openQuestions": {
      "$ref": "#/$defs/__schema3"
    },
    "constraints": {
      "$ref": "#/$defs/__schema5"
    }
  },
  "required": [
    "summary",
    "proposedSteps",
    "openQuestions",
    "constraints"
  ],
  "additionalProperties": false,
  "$defs": {
    "__schema0": {
      "type": "string",
      "minLength": 1,
      "maxLength": 1024,
      "pattern": "\\S"
    },
    "__schema1": {
      "minItems": 1,
      "maxItems": 12,
      "type": "array",
      "items": {
        "$ref": "#/$defs/__schema2"
      }
    },
    "__schema2": {
      "type": "string",
      "minLength": 1,
      "maxLength": 512,
      "pattern": "\\S"
    },
    "__schema3": {
      "maxItems": 8,
      "type": "array",
      "items": {
        "$ref": "#/$defs/__schema4"
      }
    },
    "__schema4": {
      "type": "string",
      "minLength": 1,
      "maxLength": 512,
      "pattern": "\\S"
    },
    "__schema5": {
      "maxItems": 12,
      "type": "array",
      "items": {
        "$ref": "#/$defs/__schema6"
      }
    },
    "__schema6": {
      "type": "string",
      "minLength": 1,
      "maxLength": 512,
      "pattern": "\\S"
    }
  },
  "$id": "urn:waldo:protocol:responsibility-planning-turn:0.3:candidate-plan",
  "x-waldo-validation-level": "structural-plus-runtime-invariants",
  "x-waldo-offline-commands": "none"
}
